{
  "extension.title": "–ü—Ä–æ—Å–º–æ—Ç—Ä –≠–∫—Å–ø–æ—Ä—Ç–æ–≤ SVG",
  "extension.description": "‚ú® '–ü—Ä–æ—Å–º–æ—Ç—Ä –≠–∫—Å–ø–æ—Ä—Ç–æ–≤ SVG' - —ç—Ç–æ —Ä–∞—Å—à–∏—Ä–µ–Ω–∏–µ –¥–ª—è Visual Studio Code, –ø—Ä–µ–¥–Ω–∞–∑–Ω–∞—á–µ–Ω–Ω–æ–µ –¥–ª—è —É–ø—Ä–æ—â–µ–Ω–∏—è –ø—Ä–æ—Ü–µ—Å—Å–∞ –¥–æ—Å—Ç—É–ø–∞ –∏ –∏—Å–ø–æ–ª—å–∑–æ–≤–∞–Ω–∏—è SVG-–∏–∫–æ–Ω–æ–∫. –° —ç—Ç–∏–º —Ä–∞—Å—à–∏—Ä–µ–Ω–∏–µ–º –≤—ã –º–æ–∂–µ—Ç–µ –ª–µ–≥–∫–æ –∏—Å—Å–ª–µ–¥–æ–≤–∞—Ç—å –∏ –∏—Å–∫–∞—Ç—å SVG-–∏–∫–æ–Ω–∫–∏ –≤ –≤–∞—à–µ–º –ø—Ä–æ–µ–∫—Ç–µ, —É–ø—Ä–æ—â–∞—è –∑–∞–¥–∞—á—É –∏—Ö –Ω–∞—Ö–æ–∂–¥–µ–Ω–∏—è –∏ –∏–Ω—Ç–µ–≥—Ä–∞—Ü–∏–∏ –≤ –ø—Ä–æ–µ–∫—Ç.",
  "extension.commands.showMenu.title": "–ü—Ä–æ—Å–º–æ—Ç—Ä –≠–∫—Å–ø–æ—Ä—Ç–æ–≤ SVG üîç",
  "extension.config.assetsPath.title": "–ü—É—Ç—å –∫ —Ä–µ—Å—É—Ä—Å–∞–º",
  "extension.config.assetsPath.description": "–ú–∞—Å—Å–∏–≤ –¥–ª—è —Ö—Ä–∞–Ω–µ–Ω–∏—è –ø—É—Ç–µ–π –∫ –ø—Ä–æ–∞–Ω–∞–ª–∏–∑–∏—Ä–æ–≤–∞–Ω–Ω—ã–º —Ñ–∞–π–ª–∞–º, —Å–æ–¥–µ—Ä–∂–∞—â–∏–º SVG-–∏–∫–æ–Ω–∫–∏. –≠—Ç–æ –ø–æ–∑–≤–æ–ª—è–µ—Ç –±—ã—Å—Ç—Ä–æ –ø–æ–ª—É—á–∏—Ç—å –∫ –Ω–∏–º –¥–æ—Å—Ç—É–ø –∏–∑ –≤–µ–±-–∏–Ω—Ç–µ—Ä—Ñ–µ–π—Å–∞, —Å–ª—É–∂–∞ —è—Ä–ª—ã–∫–∞–º–∏.",
  "extension.config.ignoreDirectories.title": "–ò–≥–Ω–æ—Ä–∏—Ä–æ–≤–∞—Ç—å –ö–∞—Ç–∞–ª–æ–≥–∏",
  "extension.config.ignoreDirectories.description": "–ú–∞—Å—Å–∏–≤ –¥–ª—è —Ö—Ä–∞–Ω–µ–Ω–∏—è —à–∞–±–ª–æ–Ω–æ–≤ –∫–∞—Ç–∞–ª–æ–≥–æ–≤, –∫–æ—Ç–æ—Ä—ã–µ –Ω—É–∂–Ω–æ –∏–≥–Ω–æ—Ä–∏—Ä–æ–≤–∞—Ç—å –ø—Ä–∏ –∞–Ω–∞–ª–∏–∑–µ —Ñ–∞–π–ª–æ–≤ –Ω–∞ –Ω–∞–ª–∏—á–∏–µ SVG-–∏–∫–æ–Ω–æ–∫.\n–ü–æ —É–º–æ–ª—á–∞–Ω–∏—é:\n**/.git\n**/.github\n**/.husky\n**/.idea\n**/.idx\n**/.vscode*\n**/build\n**/coverage\n**/dist\n**/node_modules\n**/out",
  "extension.config.lastScanDate.title": "–î–∞—Ç–∞ –ü–æ—Å–ª–µ–¥–Ω–µ–≥–æ –°–∫–∞–Ω–∏—Ä–æ–≤–∞–Ω–∏—è",
  "extension.config.lastScanDate.description": "–î–∞—Ç–∞ –ø–æ—Å–ª–µ–¥–Ω–µ–≥–æ —Å–∫–∞–Ω–∏—Ä–æ–≤–∞–Ω–∏—è —Ä–∞–±–æ—á–µ–π –æ–±–ª–∞—Å—Ç–∏ –Ω–∞ –Ω–∞–ª–∏—á–∏–µ SVG-–∏–∫–æ–Ω–æ–∫.",
  "extension.config.defaultIconProperties.title": "–°–≤–æ–π—Å—Ç–≤–∞ –ò–∫–æ–Ω–æ–∫ –ü–æ –£–º–æ–ª—á–∞–Ω–∏—é",
  "extension.config.defaultIconProperties.description": "–°–≤–æ–π—Å—Ç–≤–∞ –ø–æ —É–º–æ–ª—á–∞–Ω–∏—é, –ø—Ä–∏–º–µ–Ω—è–µ–º—ã–µ –∫ SVG-–∏–∫–æ–Ω–∫–∞–º, –µ—Å–ª–∏ —É –Ω–∏—Ö –Ω–µ –æ–ø—Ä–µ–¥–µ–ª–µ–Ω–æ —Å–≤–æ–π—Å—Ç–≤–æ –∏–ª–∏ –µ—Å–ª–∏ —Ä–∞—Å—à–∏—Ä–µ–Ω–∏–µ –µ–≥–æ –Ω–µ –Ω–∞—Ö–æ–¥–∏—Ç.",
  "extension.config.showNotExportedIcons.title": "–ü–æ–∫–∞–∑—ã–≤–∞—Ç—å –ù–µ—ç–∫—Å–ø–æ—Ä—Ç–∏—Ä–æ–≤–∞–Ω–Ω—ã–µ –ò–∫–æ–Ω–∫–∏",
  "extension.config.showNotExportedIcons.description": "–£–∫–∞–∑—ã–≤–∞–µ—Ç, –ø–æ–∫–∞–∑—ã–≤–∞—Ç—å –ª–∏ –∏–∫–æ–Ω–∫–∏, –∫–æ—Ç–æ—Ä—ã–µ –Ω–µ —ç–∫—Å–ø–æ—Ä—Ç–∏—Ä—É—é—Ç—Å—è.",
  "extension.config.groupPatterns.title": "–®–∞–±–ª–æ–Ω—ã –ì—Ä—É–ø–ø–∏—Ä–æ–≤–∫–∏",
  "extension.config.groupPatterns.description": "–ú–∞—Å—Å–∏–≤ —à–∞–±–ª–æ–Ω–æ–≤ –¥–ª—è –≥—Ä—É–ø–ø–∏—Ä–æ–≤–∫–∏ —Ñ–∞–π–ª–æ–≤ –∏–∫–æ–Ω–æ–∫. –ö–∞–∂–¥—ã–π —à–∞–±–ª–æ–Ω —Ç—Ä–µ–±—É–µ—Ç '—ç–ª–µ–º–µ–Ω—Ç' (—à–∞–±–ª–æ–Ω) –∏ '–∑–Ω–∞—á–µ–Ω–∏–µ' (–∏–º—è –≥—Ä—É–ø–ø—ã).\n–ü—Ä–∏–º–µ—Ä:\n| –≠–ª–µ–º–µ–Ω—Ç | –ó–Ω–∞—á–µ–Ω–∏–µ |\n| --- | --- |\n| ** | –í—Å–µ –ò–∫–æ–Ω–∫–∏ |\n| **/Flag* | –§–ª–∞–≥–∏ |\n| **/Symbol*.{js, jsx} | –°–∏–º–≤–æ–ª—ã |",
  "extension.config.recentIcons.showIcons.title": "–ü–æ–∫–∞–∑—ã–≤–∞—Ç—å –ù–µ–¥–∞–≤–Ω–∏–µ –ò–∫–æ–Ω–∫–∏",
  "extension.config.recentIcons.showIcons.description": "–£–∫–∞–∑—ã–≤–∞–µ—Ç, –ø–æ–∫–∞–∑—ã–≤–∞—Ç—å –ª–∏ –ø–æ—Å–ª–µ–¥–Ω–∏–µ –∏—Å–ø–æ–ª—å–∑–æ–≤–∞–Ω–Ω—ã–µ –∏–∫–æ–Ω–∫–∏.",
  "extension.config.recentIcons.limitShowIcons.title": "–õ–∏–º–∏—Ç –ü–æ–∫–∞–∑–∞ –ù–µ–¥–∞–≤–Ω–∏—Ö –ò–∫–æ–Ω–æ–∫",
  "extension.config.recentIcons.limitShowIcons.description": "–ú–∞–∫—Å–∏–º–∞–ª—å–Ω–æ–µ –∫–æ–ª–∏—á–µ—Å—Ç–≤–æ –ø–æ—Å–ª–µ–¥–Ω–∏—Ö –∏–∫–æ–Ω–æ–∫ –¥–ª—è –ø–æ–∫–∞–∑–∞."
}
