{
  "extension.title": "SVG-Exporte anzeigen",
  "extension.description": "‚ú® 'View Exports SVG' ist eine Visual Studio Code-Erweiterung, die entwickelt wurde, um den Zugriff und die Verwendung von SVG-Icons zu optimieren. Mit dieser Erweiterung k√∂nnen Sie m√ºhelos SVG-Icons in Ihrem Projekt erkunden und suchen, was die Aufgabe vereinfacht, sie zu finden und in Ihr Projekt zu integrieren.",
  "extension.commands.showMenu.title": "SVG-Exporte anzeigen üîç",
  "extension.config.assetsPath.title": "Assets-Pfad",
  "extension.config.assetsPath.description": "Ein Array zum Speichern der Pfade analysierter Dateien, die SVG-Icons enthalten. Dies erm√∂glicht einen schnellen Zugriff auf sie aus dem Webview heraus und dient als Verkn√ºpfungen.",
  "extension.config.ignoreDirectories.title": "Verzeichnisse ignorieren",
  "extension.config.ignoreDirectories.description": "Ein Array zum Speichern der Muster von Verzeichnissen, die beim Analysieren von Dateien nach SVG-Icons ignoriert werden sollen.\nStandard:\n**/.git\n**/.github\n**/.husky\n**/.idea\n**/.idx\n**/.vscode*\n**/build\n**/coverage\n**/dist\n**/node_modules\n**/out",
  "extension.config.lastScanDate.title": "Letztes Scan-Datum",
  "extension.config.lastScanDate.description": "Das Datum des letzten Scans des Arbeitsbereichs nach SVG-Icons.",
  "extension.config.defaultIconProperties.title": "Standard-Icon-Eigenschaften",
  "extension.config.defaultIconProperties.description": "Standard-Eigenschaften, die auf SVG-Icons angewendet werden, wenn sie keine definierte Eigenschaft haben oder wenn die Erweiterung sie nicht findet.",
  "extension.config.showNotExportedIcons.title": "Nicht exportierte Icons anzeigen",
  "extension.config.showNotExportedIcons.description": "Gibt an, ob nicht exportierte Icons angezeigt werden sollen oder nicht.",
  "extension.config.groupPatterns.title": "Gruppenmuster",
  "extension.config.groupPatterns.description": "Ein Array von Mustern zum Gruppieren von Icon-Dateien. Jedes Muster erfordert ein 'Element' (das Muster) und einen 'Wert' (den Gruppennamen).\nBeispiel:\n| Element | Wert |\n| --- | --- |\n| ** | Alle Icons |\n| **/Flag* | Flaggen |\n| **/Symbol*.{js, jsx} | Symbole |",
  "extension.config.recentIcons.showIcons.title": "Neueste Icons anzeigen",
  "extension.config.recentIcons.showIcons.description": "Gibt an, ob die zuletzt verwendeten Icons angezeigt werden sollen oder nicht.",
  "extension.config.recentIcons.limitShowIcons.title": "Anzeige der neuesten Icons begrenzen",
  "extension.config.recentIcons.limitShowIcons.description": "Die maximale Anzahl der zuletzt verwendeten Icons, die angezeigt werden sollen."
}
