{
  "extension.title": "查看導出 SVG",
  "extension.description": "✨ '查看導出 SVG' 是一個 Visual Studio Code 擴展，旨在簡化訪問和使用 SVG 圖標的過程。使用此擴展，您可以輕鬆地在項目中瀏覽和搜索 SVG 圖標，簡化了在項目中查找和集成它們的任務。",
  "extension.commands.showMenu.title": "查看導出 SVG 🔍",
  "extension.config.assetsPath.title": "資產路徑",
  "extension.config.assetsPath.description": "一個數組，用於存儲包含 SVG 圖標的已分析文件的路徑。這允許從 webview 快速訪問它們，作為快捷方式。",
  "extension.config.ignoreDirectories.title": "忽略目錄",
  "extension.config.ignoreDirectories.description": "一個數組，用於存儲在分析文件以查找 SVG 圖標時要忽略的目錄模式。\n默認：\n**/.git\n**/.github\n**/.husky\n**/.idea\n**/.idx\n**/.vscode*\n**/build\n**/coverage\n**/dist\n**/node_modules\n**/out",
  "extension.config.lastScanDate.title": "最後掃描日期",
  "extension.config.lastScanDate.description": "工作區中最後一次掃描 SVG 圖標的日期。",
  "extension.config.defaultIconProperties.title": "默認圖標屬性",
  "extension.config.defaultIconProperties.description": "當 SVG 圖標沒有定義屬性或擴展未找到時，應用於 SVG 圖標的默認屬性。",
  "extension.config.showNotExportedIcons.title": "顯示未導出的圖標",
  "extension.config.showNotExportedIcons.description": "指示是否顯示未導出的圖標。",
  "extension.config.groupPatterns.title": "分組模式",
  "extension.config.groupPatterns.description": "用於分組圖標文件的模式數組。每個模式都需要一個 '元素'（模式）和一個 '值'（組名）。\n示例：\n| 元素 | 值 |\n| --- | --- |\n| ** | 所有圖標 |\n| **/Flag* | 國旗 |\n| **/Symbol*.{js, jsx} | 符號 |",
  "extension.config.recentIcons.showIcons.title": "顯示最近的圖標",
  "extension.config.recentIcons.showIcons.description": "指示是否顯示最近訪問的圖標。",
  "extension.config.recentIcons.limitShowIcons.title": "限制顯示最近的圖標",
  "extension.config.recentIcons.limitShowIcons.description": "要顯示的最近圖標的最大數量。"
}
