{
  "extension.title": "SVGエクスポートを表示",
  "extension.description": "✨ 'SVGエクスポートを表示' は、SVGアイコンへのアクセスと利用を効率化するために設計されたVisual Studio Code拡張機能です。この拡張機能を使用すると、プロジェクト内のSVGアイコンを簡単に探索して検索し、プロジェクトに統合するタスクを簡素化できます。",
  "extension.commands.showMenu.title": "SVGエクスポートを表示 🔍",
  "extension.config.assetsPath.title": "アセットパス",
  "extension.config.assetsPath.description": "SVGアイコンを持つ解析されたファイルのパスを格納する配列です。これにより、ウェブビューからそれらに素早くアクセスでき、ショートカットとして機能します。",
  "extension.config.ignoreDirectories.title": "ディレクトリを無視",
  "extension.config.ignoreDirectories.description": "SVGアイコンのファイルを解析する際に無視するディレクトリのパターンを格納する配列です。\nデフォルト:\n**/.git\n**/.github\n**/.husky\n**/.idea\n**/.idx\n**/.vscode*\n**/build\n**/coverage\n**/dist\n**/node_modules\n**/out",
  "extension.config.lastScanDate.title": "最終スキャン日",
  "extension.config.lastScanDate.description": "ワークスペースのSVGアイコンの最終スキャン日。",
  "extension.config.defaultIconProperties.title": "デフォルトアイコンプロパティ",
  "extension.config.defaultIconProperties.description": "SVGアイコンにプロパティが定義されていない場合や拡張機能がそれを見つけられない場合に適用するデフォルトのプロパティ。",
  "extension.config.showNotExportedIcons.title": "エクスポートされていないアイコンを表示",
  "extension.config.showNotExportedIcons.description": "エクスポートされていないアイコンを表示するかどうかを示します。",
  "extension.config.groupPatterns.title": "グループパターン",
  "extension.config.recentIcons.showIcons.title": "最近のアイコンを表示",
  "extension.config.groupPatterns.description": "アイコンファイルをグループ化するためのパターンの配列です。各パターンには 「項目」（パターン）と 「値」（グループ名）が必要です。\n例:\n| 項目 | 値 |\n| --- | --- |\n| ** | すべてのアイコン |\n| **/Flag* | フラグ |\n| **/Symbol*.{js, jsx} | シンボル |",
  "extension.config.recentIcons.showIcons.description": "最近アクセスしたアイコンを表示するかどうかを示します。",
  "extension.config.recentIcons.limitShowIcons.title": "最近のアイコンの表示制限",
  "extension.config.recentIcons.limitShowIcons.description": "表示する最近のアイコンの最大数。"
}
